<?xml version="1.0" encoding="UTF-8"?>
<config xmlns:xsi="http://www.w3.org/2001/XMLSchema-instance"
	xsi:noNamespaceSchemaLocation="config.xsd">

	<items>
		<!-- Item types that may be instantiated by Item Factory -->
		<item id="Arrow" iconOpenId="23" iconClosedId="23" iconLeafId="23" />
		<item id="Backpack" />
		<item id="Bag" iconOpenId="162" iconClosedId="162" iconLeafId="162" />
		<item id="BagOfHolding" iconOpenId="162" iconClosedId="162" iconLeafId="162" />
		<item id="Box" iconOpenId="167" iconClosedId="167" iconLeafId="167" />
		<item id="Candle"  iconOpenId="182" iconClosedId="182" iconLeafId="182"/>
		<item id="Cat" javaClass="being.Cat" />
		<item id="Cloak" iconOpenId="46" iconClosedId="46" iconLeafId="46" />
		<item id="Biscuit" />
		<item id="Crossbow" iconOpenId="280" iconClosedId="280"
			iconLeafId="280" />
		<item id="CrossbowBolt" iconOpenId="23" iconClosedId="23"
			iconLeafId="23" />
		<item id="Elf" javaClass="being.Elf" />
		<item id="FlintAndTinder" />
		<item id="Fungus" />
		<item id="Halfling" javaClass="being.Halfling" />
		<item id="Hand" />
		<item id="Horse" javaClass="being.Horse" />
		<item id="Human" iconOpenId="126" iconClosedId="126" iconLeafId="126"
			javaClass="being.Human" />
		<item id="HumanoidHead" />
		<item id="Location" />
		<item id="MagicRing" iconOpenId="312" iconClosedId="312"
			iconLeafId="312" />
		<item id="OrbOfLight" />
		<item id="Purse" />
		<item id="Quiver" />
		<item id="Rat" javaClass="being.Rat" />
		<item id="Ring" iconOpenId="312" iconClosedId="312" iconLeafId="312" />
		<item id="Scabbard" />
		<item id="Shield" iconOpenId="31" iconClosedId="31" iconLeafId="31" />
		<item id="FireGroundSmall" />
		<item id="Sword" iconOpenId="3" iconClosedId="3" iconLeafId="3" />
		<item id="Torch" />
		<item id="Water" />
		<item id="Wood" />
	</items>

	<character>
		<pcClass id="Soldier" combatDice="20" magicDice="4"
			stealthDice="8" generalDice="12" encumbrance="100" mana="0"
			actionPoint="8" health="7">
			<ability id="Dweomer Lore" value="0" />
			<ability id="Mechanisms" value="0" />
			<ability id="Magical Attack" value="0" />
			<ability id="Crafting" value="3/+1" />
			<ability id="Perception" value="4" />
			<ability id="Trickery" value="0" />
			<ability id="Ranged Attack" value="3/+1" />
			<ability id="Enchantment" value="0" />
			<ability id="Advantage Attack" value="2" />
			<ability id="Resistance" value="3" />
			<ability id="Appraisal" value="3/+1" />
			<ability id="Magic Defence" value="2" />
			<ability id="Melee Attack" value="3/+1" />
			<ability id="Combat Defence" value="4/+1" />
			<ability id="Sneak" value="2" />
		</pcClass>
		<pcClass id="Warrior" combatDice="20" magicDice="4"
			stealthDice="12" generalDice="8" actionPoint="8" health="7"
			encumbrance="100" mana="0">
			<ability id="Dweomer Lore" value="0" />
			<ability id="Mechanisms" value="0" />
			<ability id="Magical Attack" value="0" />
			<ability id="Crafting" value="2" />
			<ability id="Perception" value="4" />
			<ability id="Trickery" value="1/+1" />
			<ability id="Ranged Attack" value="3/+1" />
			<ability id="Enchantment" value="0" />
			<ability id="Advantage Attack" value="2" />
			<ability id="Resistance" value="3" />
			<ability id="Appraisal" value="2" />
			<ability id="Magic Defence" value="2" />
			<ability id="Melee Attack" value="4/+1" />
			<ability id="Combat Defence" value="3/+1" />
			<ability id="Sneak" value="3/+1" />
		</pcClass>
		<pcClass id="Paladin" combatDice="20" magicDice="12"
			stealthDice="4" generalDice="8" actionPoint="8" health="6"
			encumbrance="100" mana="3">
			<ability id="Dweomer Lore" value="2" />
			<ability id="Mechanisms" value="0" />
			<ability id="Magical Attack" value="3/+1" />
			<ability id="Crafting" value="1" />
			<ability id="Perception" value="3" />
			<ability id="Trickery" value="0" />
			<ability id="Ranged Attack" value="2/+1" />
			<ability id="Enchantment" value="0" />
			<ability id="Advantage Attack" value="1" />
			<ability id="Resistance" value="3" />
			<ability id="Appraisal" value="1" />
			<ability id="Magic Defence" value="4/+1" />
			<ability id="Melee Attack" value="3/+1" />
			<ability id="Combat Defence" value="4/+1" />
			<ability id="Sneak" value="0" />
		</pcClass>
		<pcClass id="Trickster" combatDice="4" magicDice="12"
			stealthDice="20" generalDice="8" actionPoint="8" health="4"
			encumbrance="100" mana="3">
			<ability id="Dweomer Lore" value="2/+1" />
			<ability id="Mechanisms" value="2" />
			<ability id="Magical Attack" value="3/+1" />
			<ability id="Crafting" value="0" />
			<ability id="Perception" value="2" />
			<ability id="Trickery" value="4/+1" />
			<ability id="Ranged Attack" value="2" />
			<ability id="Enchantment" value="0" />
			<ability id="Advantage Attack" value="0" />
			<ability id="Resistance" value="3" />
			<ability id="Appraisal" value="2" />
			<ability id="Magic Defence" value="2/+1" />
			<ability id="Melee Attack" value="2" />
			<ability id="Combat Defence" value="2" />
			<ability id="Sneak" value="3/+1" />
		</pcClass>
		<pcClass id="Burglar" combatDice="8" magicDice="4"
			stealthDice="20" generalDice="12" encumbrance="100" mana="0"
			actionPoint="8" health="5">
			<ability id="Dweomer Lore" value="0" />
			<ability id="Mechanisms" value="4/+1" />
			<ability id="Magical Attack" value="0" />
			<ability id="Crafting" value="0" />
			<ability id="Perception" value="4/+1" />
			<ability id="Trickery" value="2" />
			<ability id="Ranged Attack" value="3" />
			<ability id="Enchantment" value="0" />
			<ability id="Advantage Attack" value="1" />
			<ability id="Resistance" value="3/+1" />
			<ability id="Appraisal" value="3/+1" />
			<ability id="Magic Defence" value="2" />
			<ability id="Melee Attack" value="3" />
			<ability id="Combat Defence" value="3" />
			<ability id="Sneak" value="3/+1" />
		</pcClass>
		<pcClass id="Assassin" combatDice="12" magicDice="4"
			stealthDice="20" generalDice="8" actionPoint="8" health="5"
			encumbrance="100" mana="0">
			<ability id="Dweomer Lore" value="0" />
			<ability id="Mechanisms" value="3" />
			<ability id="Magical Attack" value="0" />
			<ability id="Crafting" value="0" />
			<ability id="Perception" value="3" />
			<ability id="Trickery" value="2/+1" />
			<ability id="Ranged Attack" value="3/+1" />
			<ability id="Enchantment" value="0" />
			<ability id="Advantage Attack" value="4/+1" />
			<ability id="Resistance" value="3" />
			<ability id="Appraisal" value="1" />
			<ability id="Magic Defence" value="3" />
			<ability id="Melee Attack" value="2/+1" />
			<ability id="Combat Defence" value="3" />
			<ability id="Sneak" value="4/+1" />
		</pcClass>
		<pcClass id="Wizard" combatDice="4" magicDice="20"
			stealthDice="8" generalDice="12" actionPoint="8" health="4"
			encumbrance="100" mana="4">
			<ability id="Dweomer Lore" value="4/+1" />
			<ability id="Mechanisms" value="0" />
			<ability id="Magical Attack" value="4/+1" />
			<ability id="Crafting" value="3/+1" />
			<ability id="Perception" value="3" />
			<ability id="Trickery" value="0" />
			<ability id="Ranged Attack" value="1" />
			<ability id="Enchantment" value="3/+1" />
			<ability id="Advantage Attack" value="0" />
			<ability id="Resistance" value="1" />
			<ability id="Appraisal" value="3" />
			<ability id="Magic Defence" value="4/+1" />
			<ability id="Melee Attack" value="1" />
			<ability id="Combat Defence" value="1" />
			<ability id="Sneak" value="0" />
		</pcClass>
		<pcClass id="Priest" combatDice="12" magicDice="20"
			stealthDice="4" generalDice="8" actionPoint="8" health="4"
			encumbrance="100" mana="4">
			<ability id="Dweomer Lore" value="3" />
			<ability id="Mechanisms" value="0" />
			<ability id="Magical Attack" value="3/+1" />
			<ability id="Crafting" value="1" />
			<ability id="Perception" value="3" />
			<ability id="Trickery" value="1" />
			<ability id="Ranged Attack" value="1" />
			<ability id="Enchantment" value="2/+1" />
			<ability id="Advantage Attack" value="1" />
			<ability id="Resistance" value="2" />
			<ability id="Appraisal" value="2" />
			<ability id="Magic Defence" value="4/+1" />
			<ability id="Melee Attack" value="2/+1" />
			<ability id="Combat Defence" value="1/+1" />
			<ability id="Sneak" value="0" />
		</pcClass>
		<pcClass id="Druid" combatDice="8" magicDice="20" stealthDice="4"
			generalDice="12" actionPoint="8" health="4" encumbrance="100" mana="4">
			<ability id="Dweomer Lore" value="2" />
			<ability id="Mechanisms" value="0" />
			<ability id="Magical Attack" value="3/+1" />
			<ability id="Crafting" value="2/+1" />
			<ability id="Perception" value="4" />
			<ability id="Trickery" value="0" />
			<ability id="Ranged Attack" value="2" />
			<ability id="Enchantment" value="1/+1" />
			<ability id="Advantage Attack" value="1" />
			<ability id="Resistance" value="2" />
			<ability id="Appraisal" value="0" />
			<ability id="Magic Defence" value="4/+1" />
			<ability id="Melee Attack" value="2" />
			<ability id="Combat Defence" value="2" />
			<ability id="Sneak" value="3/+1" />
		</pcClass>
		<pcClass id="Witch" combatDice="8" magicDice="12" stealthDice="12"
			generalDice="12" actionPoint="8" health="4" encumbrance="100" mana="4">
			<ability id="Dweomer Lore" value="2" />
			<ability id="Mechanisms" value="0" />
			<ability id="Magical Attack" value="3/+1" />
			<ability id="Crafting" value="4" />
			<ability id="Perception" value="3" />
			<ability id="Trickery" value="2/+1" />
			<ability id="Ranged Attack" value="2" />
			<ability id="Enchantment" value="1/+1" />
			<ability id="Advantage Attack" value="0" />
			<ability id="Resistance" value="1/+1" />
			<ability id="Appraisal" value="0" />
			<ability id="Magic Defence" value="3/+1" />
			<ability id="Melee Attack" value="2" />
			<ability id="Combat Defence" value="2" />
			<ability id="Sneak" value="3" />
		</pcClass>
		<pcClass id="Hunter" combatDice="12" magicDice="8"